{
  "$schema": "glossary.schema.json",
  "transliteration": "RU canon = literature (sources.json book/translation) when present; else Polivanov in ru.canon (field basis: literature | polivanov | loanword | translation | owner). JA canon from sources; basis inferred when kanji are reconstructed from romaji only. Club/slang/translit variants stay in variants[]. EN canon = one label without parentheses (detail in def).",
  "mermaid": "%% generated placeholder — see glossary_build.mjs",
  "terms": [
    {
      "id": "mari",
      "group": "a",
      "family": "base",
      "def": "Шар из наполнителя, обмотанный тонкой нитью; в него делают все захваты",
      "sources": [
        "OLY-BASIC",
        "SAN-KIT001",
        "TK-SIZE"
      ],
      "status": "source",
      "ru": {
        "canon": "мари",
        "ui": "основа",
        "variants": [
          {
            "form": "основа",
            "kind": "translation",
            "source": "glossary-root"
          }
        ],
        "basis": "polivanov"
      },
      "ja": {
        "canon": "土台まり",
        "kana": "どだいまり",
        "variants": [
          {
            "form": "まり",
            "kind": "short",
            "source": "OLY-BASIC"
          }
        ]
      },
      "romaji": {
        "canon": "dodai mari",
        "variants": []
      },
      "en": {
        "canon": "mari ball",
        "variants": []
      }
    },
    {
      "id": "jimaki",
      "group": "a",
      "family": "base",
      "def": "Поверхностный слой тонкой нити на шарике-основе; в нём прячут концы",
      "sources": [
        "OLY-BASIC",
        "TK-ANCHOR"
      ],
      "status": "source",
      "code": [
        "wrapThread"
      ],
      "ru": {
        "canon": "обмотка основы",
        "variants": [],
        "basis": "translation"
      },
      "ja": {
        "canon": "地巻き",
        "variants": [
          {
            "form": "巻き",
            "kind": "descriptive",
            "source": "glossary-root",
            "note": "общее maki; канон 地巻き"
          }
        ]
      },
      "romaji": {
        "canon": "jimaki",
        "variants": []
      },
      "en": {
        "canon": "jimaki",
        "variants": []
      }
    },
    {
      "id": "marking",
      "group": "a",
      "family": "marking",
      "def": "Нити по меридианам (и экватору), делящие шар; кагари цепляется за них",
      "sources": [
        "OLY-BASIC",
        "SUESS-GLOSS"
      ],
      "status": "source",
      "code": [
        "generator"
      ],
      "ru": {
        "canon": "разметка",
        "variants": []
      },
      "ja": {
        "canon": "地割り",
        "variants": []
      },
      "romaji": {
        "canon": "jiwari",
        "variants": []
      },
      "en": {
        "canon": "marking lines",
        "variants": []
      }
    },
    {
      "id": "tanjunTobun",
      "group": "a",
      "family": "marking",
      "def": "N меридианов через 360°/N (Simple 8 и т.п.)",
      "sources": [
        "TK-SIMPLE",
        "FJX-TOBUN"
      ],
      "status": "source",
      "code": [],
      "ru": {
        "canon": "простое деление",
        "variants": []
      },
      "ja": {
        "canon": "単純等分",
        "variants": [
          {
            "form": "N等分",
            "kind": "descriptive",
            "source": "glossary-root"
          }
        ]
      },
      "romaji": {
        "canon": "tanjun tōbun",
        "variants": [
          {
            "form": "toubun",
            "kind": "translit-club",
            "source": "FJX-TOBUN"
          }
        ]
      },
      "en": {
        "canon": "simple equal division (S-N)",
        "variants": []
      }
    },
    {
      "id": "kumiawaseTobun",
      "group": "a",
      "family": "marking",
      "def": "Сложная разметка C8/C10 и др.",
      "sources": [
        "TK-SIMPLE"
      ],
      "status": "source",
      "code": [
        "generator:C8",
        "generator:C10",
        "generator:C6"
      ],
      "ru": {
        "canon": "комбинированное деление",
        "variants": []
      },
      "ja": {
        "canon": "組み合わせ等分",
        "variants": []
      },
      "romaji": {
        "canon": "kumiawase tōbun",
        "variants": []
      },
      "en": {
        "canon": "combination division (C-N)",
        "variants": []
      }
    },
    {
      "id": "NP",
      "group": "a",
      "family": "marking",
      "def": "Точка, из которой расходятся линии разметки (северный полюс)",
      "sources": [
        "SUESS-GLOSS",
        "OLY-TM7-V"
      ],
      "status": "source",
      "ru": {
        "canon": "северный полюс",
        "ui": "СП",
        "variants": []
      },
      "ja": {
        "canon": "北極",
        "variants": []
      },
      "romaji": {
        "canon": "hokkyoku",
        "variants": []
      },
      "en": {
        "canon": "north pole",
        "variants": []
      }
    },
    {
      "id": "equator",
      "group": "a",
      "family": "marking",
      "def": "Большой круг посередине между полюсами",
      "sources": [
        "SUESS-GLOSS",
        "OLY-TM7-L"
      ],
      "status": "source",
      "code": [
        "bottomFromEq"
      ],
      "ru": {
        "canon": "экватор",
        "variants": []
      },
      "ja": {
        "canon": "赤道",
        "variants": []
      },
      "romaji": {
        "canon": "sekidō",
        "variants": []
      },
      "en": {
        "canon": "equator",
        "variants": []
      }
    },
    {
      "id": "machibari",
      "group": "a",
      "family": "marking",
      "def": "Цветные булавки в опорных точках разметки",
      "sources": [
        "OLY-TM7-L",
        "TK-GT14"
      ],
      "status": "source",
      "ru": {
        "canon": "булавки-метки",
        "variants": [
          {
            "form": "разметочные булавки",
            "kind": "translation",
            "source": "legacy"
          }
        ]
      },
      "ja": {
        "canon": "待ち針",
        "kana": "まちばり",
        "variants": [
          {
            "form": "まち針",
            "kind": "orthographic",
            "source": "OLY-TM7-L"
          },
          {
            "form": "ピン",
            "kind": "short",
            "source": "OLY-TM7-L"
          }
        ]
      },
      "romaji": {
        "canon": "machibari",
        "variants": []
      },
      "en": {
        "canon": "marking pins",
        "variants": []
      }
    },
    {
      "id": "kamiTape",
      "group": "a",
      "family": "marking",
      "def": "Мерная полоска для окружности и точек",
      "sources": [
        "TK-SIMPLE",
        "SAN-KIT001"
      ],
      "status": "source",
      "ru": {
        "canon": "бумажная лента",
        "variants": []
      },
      "ja": {
        "canon": "紙テープ",
        "variants": []
      },
      "romaji": {
        "canon": "kami tēpu",
        "variants": []
      },
      "en": {
        "canon": "paper strip",
        "variants": []
      }
    },
    {
      "id": "kagari",
      "group": "b",
      "family": "rows-from-centre",
      "def": "Стежок: игла под линией разметки и поверхностью обмотки на ~1–2 мм",
      "sources": [
        "TK-KAGARI",
        "OLY-BASIC"
      ],
      "status": "source",
      "ru": {
        "canon": "кагари",
        "variants": [],
        "basis": "polivanov"
      },
      "ja": {
        "canon": "かがり",
        "variants": []
      },
      "romaji": {
        "canon": "kagari",
        "variants": []
      },
      "en": {
        "canon": "kagari stitching",
        "variants": []
      }
    },
    {
      "id": "chidori",
      "group": "b",
      "family": "rows-from-centre",
      "def": "Зигзаг между двумя рядами точек; не путать с herringbone",
      "sources": [
        "TK-CHIDORI",
        "SUESS-GLOSS"
      ],
      "status": "source",
      "ru": {
        "canon": "тидори",
        "variants": [
          {
            "form": "чидори",
            "kind": "translit-club",
            "source": "legacy"
          },
          {
            "form": "чидори-кагари",
            "kind": "orthographic",
            "source": "legacy"
          },
          {
            "form": "зигзаг",
            "kind": "descriptive",
            "source": "glossval-v2"
          }
        ],
        "basis": "polivanov"
      },
      "ja": {
        "canon": "千鳥かがり",
        "kana": "ちどりかがり",
        "variants": []
      },
      "romaji": {
        "canon": "chidori kagari",
        "variants": [
          {
            "form": "chidori",
            "kind": "translit-club",
            "source": "TK-CHIDORI"
          }
        ]
      },
      "en": {
        "canon": "chidori kagari",
        "variants": [
          {
            "form": "herringbone stitch",
            "kind": "descriptive",
            "source": "SUESS-GLOSS"
          }
        ],
        "short": "chidori"
      }
    },
    {
      "id": "uwagake",
      "group": "b",
      "family": "rows-from-centre",
      "def": "Зигзаг, где у полярных точек новая нить идёт поверх прежних рядов и стежок берёт их все под иглу",
      "sources": [
        "TK-UWA",
        "SUESS-GLOSS"
      ],
      "status": "source",
      "code": [
        "V17"
      ],
      "note": "В коде topRule пока braid (коммит переименования — отдельно)",
      "ru": {
        "canon": "увагакэ тидори",
        "ui": "uwagake",
        "variants": [
          {
            "form": "увагаке чидори",
            "kind": "translit-club",
            "source": "legacy"
          },
          {
            "form": "увагаке",
            "kind": "translit-club",
            "source": "legacy"
          },
          {
            "form": "увагаки",
            "kind": "translit-club",
            "source": "glossval-v2"
          },
          {
            "form": "увагаке-чидори",
            "kind": "orthographic",
            "source": "legacy"
          },
          {
            "form": "косичка",